,q,i,a
0,What are the symptoms of blepharitis?,<noinput>,"The symptoms of blepharitis include sore eyelids, itchy eyes, a gritty feeling in the eyes, flakes or crusts around the roots of the eyelashes, and eyelids sticking together in the morning when you wake up."
1,How can I treat and prevent blepharitis?,<noinput>,"To treat and prevent blepharitis, you should clean your eyelids twice a day to start with, and then once a day as your symptoms improve. You should also continue to clean your eyes, even if your symptoms clear up. It is recommended not to wear contact lenses and avoid using eye makeup, especially eyeliner and mascara, while you have symptoms."
2,How can I clean my eyes to alleviate blepharitis symptoms?,<noinput>,"You can clean your eyes by soaking a clean flannel or cotton wool in warm water and placing it on your closed eyelid for 5 to 10 minutes. Then gently massage your eyelids for around 30 seconds. Clean your eyelids using cotton wool or a cotton bud, and you can use a small amount of baby shampoo in water. Finally, wipe along the edge of your eyelids to remove any flakes or crusts."
3,How can a pharmacist help with blepharitis?,<noinput>,"A pharmacist might be able to suggest things to help keep your eyelids clean, including eye pads, wipes, and eye drops."
4,When should I see a GP for blepharitis?,<noinput>,You should see a GP if your blepharitis symptoms do not improve after a few weeks of cleaning your eyelids.
5,What treatment options can a GP offer for blepharitis?,<noinput>,"A GP might suggest using an antibiotic cream or ointment that you rub on your eyelid if your blepharitis does not clear up after cleaning your eyelids regularly. Antibiotic eye drops or tablets may be recommended if blepharitis has caused other problems. In severe cases or if you have other eye symptoms, the GP may refer you to an eye specialist."
6,What are the common causes of blepharitis?,<noinput>,"Blepharitis can be caused by a type of bacteria that lives on the skin, a skin condition such as seborrhoeic dermatitis, or the glands inside the eyelids not producing enough oil. It's important to note that blepharitis cannot be spread to other people."
7,Can blepharitis be spread to other people?,<noinput>,"No, blepharitis cannot be spread to other people."
0,What are the symptoms of blepharitis?,<noinput>,"Symptoms of blepharitis include sore eyelids, itchy eyes, a gritty feeling in the eyes, flakes or crusts around the roots of the eyelashes, and eyelids sticking together in the morning when you wake up."
1,How can I treat and prevent blepharitis?,<noinput>,"To treat and prevent blepharitis, you should clean your eyelids twice a day to start with and then once a day as your symptoms improve. Even if your symptoms clear up, continue to clean your eyes. Avoid wearing contact lenses and using eye makeup, especially eyeliner and mascara, while you have symptoms. You can clean your eyes by soaking a clean flannel or cotton wool in warm water, placing it on your closed eyelid for 5 to 10 minutes, gently massaging your eyelids for around 30 seconds, and then cleaning your eyelids using cotton wool or a cotton bud with a small amount of baby shampoo in water."
2,What can a pharmacist suggest to help with blepharitis?,<noinput>,"A pharmacist might be able to suggest things to help keep your eyelids clean, including eye pads, wipes, and eyedrops."
3,When should I see a GP for blepharitis?,<noinput>,You should see a GP if your blepharitis symptoms do not improve after a few weeks of cleaning your eyelids.
4,What can a GP recommend for treating blepharitis?,<noinput>,"A GP might suggest using an antibiotic cream or ointment that you rub on your eyelid if your blepharitis does not clear up after cleaning your eyelids regularly. If blepharitis has caused other problems, such as a cyst, antibiotic eyedrops or tablets may be recommended. For severe blepharitis or if you have other eye symptoms, the GP may refer you to an eye specialist."
5,What are the causes of blepharitis?,<noinput>,"Blepharitis can be caused by a type of bacteria that lives on the skin, a skin condition such as seborrhoeic dermatitis, or the glands inside the eyelids not producing enough oil. It cannot be spread to other people."
0,What are the symptoms of blepharitis?,<noinput>,"Symptoms of blepharitis include sore eyelids, itchy eyes, a gritty feeling in the eyes, flakes or crusts around the roots of the eyelashes, and eyelids sticking together in the morning when you wake up."
1,How can I treat and prevent blepharitis?,<noinput>,"To treat and prevent blepharitis, you should clean your eyelids twice a day and then once a day as your symptoms improve. It is important to continue cleaning your eyes, even if your symptoms clear up. You should also avoid wearing contact lenses and using eye makeup, especially eyeliner and mascara, while you have symptoms. Additionally, you can soak a clean flannel or cotton wool in warm water, place it on your closed eyelid for 5 to 10 minutes, gently massage your eyelids, and clean your eyelids using cotton wool or a cotton bud."
2,What can a pharmacist suggest to help with blepharitis?,<noinput>,"A pharmacist might be able to suggest things to help keep your eyelids clean, including eye pads, wipes, and eyedrops."
3,When should I see a GP for blepharitis?,<noinput>,You should see a GP if your blepharitis symptoms do not improve after a few weeks of cleaning your eyelids.
4,What treatment can a GP provide for blepharitis?,<noinput>,"A GP might suggest using an antibiotic cream or ointment that you rub on your eyelid if your blepharitis does not clear up after cleaning your eyelids regularly. In some cases, antibiotic eyedrops or tablets may be recommended. If your blepharitis is severe or if you also have other eye symptoms, the GP may refer you to an eye specialist."
5,What causes blepharitis?,<noinput>,"Blepharitis can be caused by a type of bacteria that lives on the skin, a skin condition such as seborrhoeic dermatitis, or the glands inside the eyelids not producing enough oil. It is not spread to other people."
6,Can blepharitis be spread to other people?,<noinput>,"No, blepharitis cannot be spread to other people."
7,Tell me more about eyelid problems,<noinput>,"There are various eyelid problems that can occur, including blepharitis. If you want more information on eyelid problems, it is recommended to consult reliable sources."
8,How should I clean my eyes to treat blepharitis?,<noinput>,"To clean your eyes for blepharitis treatment, you can soak a clean flannel or cotton wool in warm water and place it on your closed eyelid for 5 to 10 minutes. Gently massage your eyelids for around 30 seconds. Clean your eyelids using cotton wool or a cotton bud. It might help to use a small amount of baby shampoo in water. Gently wipe along the edge of your eyelids to remove any flakes or crusts."
9,What are the non-urgent advice for blepharitis?,<noinput>,Non-urgent advice for blepharitis is to see a GP if your symptoms do not improve after a few weeks of cleaning your eyelids.
