,q,i,a
0,What is a CT scan used for?,<noinput>,"CT scans can be used to diagnose conditions, guide further tests or treatments, and monitor conditions, such as detecting damage to bones, injuries to internal organs, problems with blood flow, stroke, and cancer."
1,How should I prepare for a CT scan?,<noinput>,"You may be advised to avoid eating anything for several hours before your CT scan, and inform the hospital about any allergies, kidney problems, or medication for diabetes. It is also important to let them know if you are pregnant."
2,What happens before a CT scan?,<noinput>,"Before the scan, you may be given a contrast dye to help improve the quality of the images. You may also be asked to remove your clothing and any metal objects, as they can interfere with the scanning equipment."
3,What happens during a CT scan?,<noinput>,"During the scan, you'll lie on a flat bed and pass through a rotating ring in the CT scanner. A radiographer will operate the scanner from a nearby room, and you'll be able to communicate with them through an intercom. You'll need to lie still and may be asked to breathe in or out at certain points."
4,What happens after a CT scan?,<noinput>,"After a CT scan, you can resume your normal activities. If a contrast was used, you may need to wait in the hospital for a short time to ensure you don't have a reaction. The scan results will be processed and analyzed by a radiologist, who will then share the results with your doctor."
5,Are CT scans safe?,<noinput>,"CT scans are generally safe, but there is a small risk of allergic reaction to the contrast dye and exposure to X-ray radiation. The amount of radiation exposure is carefully controlled during a CT scan, and the benefits and risks will be evaluated before recommending a scan."
6,Can CT scans detect cancer?,<noinput>,"Yes, CT scans can help in the diagnosis of cancer. They can provide detailed images of the internal organs, blood vessels, and bones, allowing doctors to locate and determine the size and shape of tumors before further treatment."
7,Can pregnant women have CT scans?,<noinput>,"CT scans are not usually recommended for pregnant women, unless it's an emergency situation. There is a small chance that the X-rays used in the scan could potentially harm the baby."
8,How long does a CT scan take?,<noinput>,"The duration of a CT scan can vary, but it generally takes around 10 to 20 minutes."
9,When will I receive the results of my CT scan?,<noinput>,"After your CT scan, the images will be analyzed by a radiologist, who will then prepare a report. The report will be sent to the doctor who referred you for the scan, and you will typically receive the results within a few days or weeks."
0,What is a CT scan?,<noinput>,A CT scan uses X-rays and a computer to create detailed images of the inside of the body.
1,Who performs CT scans?,<noinput>,CT scans are carried out by specially trained operators called radiographers.
2,What can CT scans be used for?,<noinput>,"CT scans can be used to diagnose conditions, guide further tests or treatments, and monitor conditions."
3,How should I prepare for a CT scan?,You may be advised to avoid eating anything for several hours before your scan.,You may be advised to avoid eating anything for several hours before your scan and remove jewellery and clothes containing metal.
4,What happens before a CT scan?,<noinput>,"Before a CT scan, you may be given a special dye to help improve the quality of the images."
5,What happens during a CT scan?,<noinput>,"During a CT scan, you'll lie on a flat bed that passes through the scanner while the radiographer operates it from the next room."
6,Are there any after-effects after a CT scan?,<noinput>,There are usually no after-effects after a CT scan and you can resume normal activities.
7,When will I get the results of my CT scan?,<noinput>,The scan results will be processed and analyzed by a radiologist before being sent to the doctor who referred you. This may take a few days or weeks.
8,What are the safety considerations of CT scans?,<noinput>,"CT scans are generally safe, but there is a small risk of an allergic reaction and exposure to X-ray radiation."
9,What is the risk of developing cancer from CT scans?,<noinput>,"Exposure to radiation during CT scans could slightly increase the risk of developing cancer in the future, although this risk is thought to be very small."
