,q,i,a
0,What are the symptoms of fibromyalgia?,<noinput>,"Symptoms of fibromyalgia include increased sensitivity to pain, muscle stiffness, difficulty sleeping, problems with mental processes, headaches, irritable bowel syndrome (IBS), and feelings of frustration or low mood."
1,How is fibromyalgia treated?,<noinput>,"Fibromyalgia can be treated with lifestyle changes such as exercise and relaxation techniques, talking therapies like cognitive behavioral therapy (CBT), and medication such as antidepressants. Exercise in particular has been shown to help reduce pain."
2,What causes fibromyalgia?,<noinput>,"The exact cause of fibromyalgia is unknown, but it is thought to be related to abnormal levels of certain chemicals in the brain and changes in the way the central nervous system processes pain messages. It may also have genetic factors and be triggered by physical or emotional factors."
3,Who is affected by fibromyalgia?,<noinput>,"Fibromyalgia can affect anyone, but it is more common in women than men. It typically develops between the ages of 25 and 55, but can occur at any age. It is estimated that nearly 1 in 20 people may be affected by fibromyalgia to some degree."
4,Are there support groups for fibromyalgia?,<noinput>,"Yes, there are support groups available for people with fibromyalgia. One example is Fibromyalgia Action UK, which offers information, support, and a helpline. Another organization is UK Fibromyalgia, which can provide information and help connect you with a support group in your area."
5,What are the benefits of exercise for fibromyalgia?,<noinput>,"Exercise has several benefits for people with fibromyalgia, including helping to reduce pain. It can also improve strength, flexibility, and overall fitness. However, it's important to work with a healthcare professional to develop an exercise program suitable for your individual needs."
6,Can fibromyalgia be cured?,<noinput>,"Currently, there is no cure for fibromyalgia. However, there are treatments available that can help manage the symptoms and make the condition easier to live with. These can include lifestyle changes, talking therapies, and medication."
7,How is fibromyalgia diagnosed?,<noinput>,"Fibromyalgia can be a difficult condition to diagnose because there is no specific test for it. The diagnosis is typically based on the presence of widespread pain and other symptoms, along with ruling out other possible causes. A healthcare professional will conduct a thorough evaluation to make a diagnosis."
8,What are some common triggers for fibromyalgia?,<noinput>,"Fibromyalgia can be triggered by physical or emotional factors such as an injury, infection, or stress. It is important to identify and manage these triggers to help minimize symptoms and improve quality of life."
9,What is Fibromyalgia Action UK?,<noinput>,Fibromyalgia Action UK is a charity that provides information and support to people with fibromyalgia. They have a helpline and regional coordinators who can help connect you with support groups in your area.
0,What are the symptoms of fibromyalgia?,<noinput>,"Symptoms of fibromyalgia include increased sensitivity to pain, muscle stiffness, difficulty sleeping, problems with mental processes, headaches, irritable bowel syndrome, and mood changes."
1,How is fibromyalgia treated?,<noinput>,"Treatment for fibromyalgia involves lifestyle changes such as exercise, talking therapies like cognitive behavioral therapy, and medication such as antidepressants. Exercise has particularly beneficial effects for reducing pain."
2,What causes fibromyalgia?,<noinput>,"The exact cause of fibromyalgia is unknown, but it is believed to be related to abnormal levels of chemicals in the brain and changes in the central nervous system's processing of pain messages. Genetics may also play a role, and physical or emotional triggers like injuries, infections, or stress can contribute to its development."
3,Who is most commonly affected by fibromyalgia?,<noinput>,"Fibromyalgia can affect anyone, but it is more common in women than men. It usually develops between the ages of 25 and 55, but people of any age, including children and older adults, can be affected. The exact prevalence of the condition is still uncertain due to difficulties in diagnosis."
4,Are there support groups for people with fibromyalgia?,<noinput>,"Yes, support groups like Fibromyalgia Action UK and UK Fibromyalgia offer information and support to individuals with fibromyalgia. Fibromyalgia Action UK has a helpline and regional coordinators who can connect you to nearby support groups."
5,Can fibromyalgia be cured?,<noinput>,"Currently, there is no cure for fibromyalgia. However, there are treatments available to help relieve symptoms and improve quality of life."
6,Is fibromyalgia more common in men or women?,<noinput>,Fibromyalgia is more common in women than men.
7,What are the lifestyle changes recommended for fibromyalgia?,<noinput>,Lifestyle changes such as exercise programs and relaxation techniques are recommended for managing fibromyalgia symptoms. These changes can help reduce pain and improve overall well-being.
8,Are there any specific tests to diagnose fibromyalgia?,<noinput>,"There are no specific tests for diagnosing fibromyalgia. Diagnosis is typically based on the presence of widespread pain and other associated symptoms, as well as ruling out other conditions with similar symptoms."
9,What organizations provide support for individuals with fibromyalgia?,<noinput>,Organizations like Fibromyalgia Action UK and UK Fibromyalgia offer support and information for individuals with fibromyalgia. They can provide access to support groups and answer questions about the condition.
