,q,i,a
0,What are the reasons for needing a gastrectomy?,<noinput>,"A gastrectomy is often performed to treat stomach cancer, obesity, esophageal cancer, stomach ulcers, and non-cancerous tumors."
1,What are the different types of gastrectomy?,<noinput>,"There are four main types of gastrectomy: total gastrectomy, partial gastrectomy, sleeve gastrectomy, and esophagogastrectomy."
2,How is a gastrectomy performed?,<noinput>,"A gastrectomy can be done through open surgery or keyhole surgery. Open surgery involves a large cut, while keyhole surgery involves smaller cuts using laparoscopic techniques."
3,What happens to the digestive system after a gastrectomy?,<noinput>,"After a gastrectomy, the digestive system still functions, although not as effectively. The remaining part of the stomach or the small intestine is connected to the esophagus."
4,"Which technique is usually faster to recover from, open gastrectomy or keyhole surgery?",<noinput>,Keyhole surgery (laparoscopic gastrectomy) typically allows for faster recovery and less post-operative pain compared to open gastrectomy.
5,What are the possible complications of a gastrectomy?,<noinput>,"Complications of a gastrectomy can include infection, bleeding, leaking from the surgical site, and long-term issues like anemia or osteoporosis."
6,How long is the usual hospital stay after a gastrectomy?,<noinput>,"After a gastrectomy, the typical hospital stay is around 1 to 2 weeks."
7,What dietary changes may be necessary after a gastrectomy?,<noinput>,"Following a gastrectomy, dietary changes may include eating frequent small meals instead of three large meals a day and potentially taking vitamin supplements."
8,Is a gastrectomy considered a major operation?,<noinput>,"Yes, a gastrectomy is considered a major operation and requires a significant recovery period."
9,Can a gastrectomy result in a reduction in vitamin absorption?,<noinput>,"Yes, a gastrectomy can reduce the body's ability to absorb certain vitamins, potentially leading to conditions such as anemia or osteoporosis."
0,What is a gastrectomy?,<noinput>,"A gastrectomy is a surgical procedure where all or part of the stomach is removed, often used to treat stomach cancer or obesity."
1,What are the different types of gastrectomy?,<noinput>,"There are four main types of gastrectomy: total gastrectomy, partial gastrectomy, sleeve gastrectomy, and esophagogastrectomy."
2,How is a gastrectomy performed?,<noinput>,"There are two techniques for performing a gastrectomy: open gastrectomy, where a large cut is made, and keyhole surgery (laparoscopic gastrectomy), where several smaller cuts are made."
3,What is the recovery process after a gastrectomy?,<noinput>,"Recovering from a gastrectomy can take a long time, with a hospital stay of 1-2 weeks and potential changes to the diet."
4,What are the possible complications of a gastrectomy?,<noinput>,"Possible complications of a gastrectomy include infection, bleeding, leaking from the stitched area, and issues with vitamin absorption."
5,When is a gastrectomy needed?,<noinput>,"A gastrectomy is often needed to treat stomach cancer, but it can also be used for other conditions such as obesity, esophageal cancer, stomach ulcers, and non-cancerous tumors."
6,What are the advantages and disadvantages of open gastrectomy?,<noinput>,"Open gastrectomies are usually more effective in treating advanced stomach cancer, but they may have a longer recovery time and more pain compared to keyhole surgery."
7,What is the difference between a total gastrectomy and a partial gastrectomy?,<noinput>,"In a total gastrectomy, the entire stomach is removed, while in a partial gastrectomy, only the lower part of the stomach is removed."
8,What changes may be needed in the diet after a gastrectomy?,<noinput>,"After a gastrectomy, changes to the diet may include eating frequent small meals instead of 3 large meals a day and possibly taking vitamin supplements."
9,What are the risks of a gastrectomy?,<noinput>,"Risks of a gastrectomy include infection, bleeding, leakage, and potential problems like anemia or osteoporosis due to reduced vitamin absorption."
