,q,i,a
0,What are the common health problems that may require a hysterectomy?,<noinput>,"Hysterectomies are carried out to treat health problems that affect the female reproductive system such as heavy periods, long-term pelvic pain, non-cancerous tumors (fibroids), ovarian cancer, womb cancer, cervical cancer, or cancer of the fallopian tubes."
1,What are the things to consider before having a hysterectomy?,<noinput>,"Before having a hysterectomy, you need to consider whether to also have your cervix or ovaries removed, based on your personal feelings, medical history, and any recommendations from your doctor."
2,What are the different types of hysterectomy?,<noinput>,"The main types of hysterectomy are total hysterectomy, subtotal hysterectomy, total hysterectomy with bilateral salpingo-oophorectomy, and radical hysterectomy. The type of surgery depends on the purpose of the operation and how much of your reproductive system can be left in place."
3,How is a hysterectomy performed?,<noinput>,"A hysterectomy can be performed through laparoscopic surgery, vaginal surgery, or abdominal surgery, depending on the specific circumstances and the surgeon's preference."
4,What are the potential complications of a hysterectomy?,<noinput>,"Complications of a hysterectomy may include heavy bleeding, infection, damage to the bladder or bowel, or a serious reaction to the general anesthesia."
5,How long does it take to recover from a hysterectomy?,<noinput>,"Recovering from a hysterectomy can take about 6 to 8 weeks, with hospital stays typically lasting up to 5 days. Recovery time may vary depending on the type of hysterectomy performed."
6,What is surgical menopause?,<noinput>,Surgical menopause refers to the menopause that occurs immediately after a hysterectomy when the ovaries are removed. Hormone replacement therapy (HRT) may be offered to manage the symptoms of surgical menopause.
7,What are the components of the female reproductive system?,<noinput>,"The female reproductive system includes the womb (uterus), cervix, vagina, fallopian tubes, and ovaries."
8,What happens if ovaries are left intact during a hysterectomy?,<noinput>,"If 1 or both ovaries are left intact during a hysterectomy, there is a chance of experiencing menopause sooner than if a hysterectomy was not performed."
9,What is the purpose of the womb (uterus) in the female reproductive system?,<noinput>,The womb (uterus) is a pear-shaped organ in the pelvis where a baby develops. The lining of the womb is shed during a menstrual period.
0,What health problems can a hysterectomy treat?,<noinput>,"Hysterectomies can be performed to treat heavy periods, long-term pelvic pain, non-cancerous tumors (fibroids), ovarian cancer, womb cancer, cervical cancer or cancer of the fallopian tubes."
1,What are the things to consider before having a hysterectomy?,<noinput>,"Before having a hysterectomy, you should consider whether to also remove your cervix or ovaries. Your decision should be based on personal feelings, medical history, and recommendations from your doctor."
2,What are the main types of hysterectomy?,<noinput>,"The main types of hysterectomy are total hysterectomy, subtotal hysterectomy, total hysterectomy with bilateral salpingo-oophorectomy, and radical hysterectomy."
3,How is a hysterectomy performed?,<noinput>,"A hysterectomy can be performed through laparoscopic surgery, vaginal surgery, or abdominal surgery."
4,What are the possible complications of a hysterectomy?,<noinput>,"Possible complications of a hysterectomy include heavy bleeding, infection, damage to the bladder or bowel, and a serious reaction to the general anesthesia."
5,How long does it take to recover from a hysterectomy?,<noinput>,"Recovery from a hysterectomy can take about 6 to 8 weeks, but it may vary depending on the type of hysterectomy performed. Resting and avoiding heavy lifting is important during the recovery period."
6,What is surgical menopause?,<noinput>,"If the ovaries are removed during a hysterectomy, it can lead to immediate menopause. This is known as surgical menopause. Hormone replacement therapy (HRT) may be offered to manage the symptoms."
7,What organs make up the female reproductive system?,<noinput>,"The female reproductive system consists of the womb (uterus), cervix, vagina, fallopian tubes, and ovaries."
8,"After a hysterectomy, will I still have periods?",<noinput>,"If you have a hysterectomy, regardless of your age, you will no longer have periods if you have not already gone through menopause."
9,How common is a hysterectomy in women aged 40 to 50?,<noinput>,Hysterectomies are more common in women aged 40 to 50.
