,q,i,a
0,What are the symptoms of intracranial hypertension?,<noinput>,"Symptoms of intracranial hypertension (IH) can include: a constant throbbing headache, temporary loss of vision, feeling and being sick, feeling sleepy, feeling irritable, problems with coordination and balance, mental confusion, and loss of feeling or weakness."
1,What immediate action should be taken if someone experiences symptoms of intracranial hypertension?,<noinput>,"Immediate action required: Call 999 or go to A&E if you have any of these symptoms and: they've come on quickly, you've recently had a head injury, or you have a high temperature or feel generally unwell."
2,How is intracranial hypertension diagnosed?,<noinput>,"A GP may suspect you have intracranial hypertension (IH) if you have symptoms of increased pressure on your brain. You may have several different tests to diagnose IH, such as an examination of your functions, an assessment of your eyes and vision, a CT or MRI scan of your brain, and a lumbar puncture."
3,What are the treatments for idiopathic intracranial hypertension?,<noinput>,"Treatments for idiopathic intracranial hypertension (IH) can include losing weight if you're overweight, stopping any medicine that may be causing your symptoms, medicine to remove excess fluid from the body, medicine to reduce the production of cerebrospinal fluid, a short course of steroid medicine, regular lumbar punctures, and surgery."
4,When is surgery considered for idiopathic intracranial hypertension?,<noinput>,"Surgery may be considered if other treatments do not help, particularly if your vision is getting worse or you're at risk of loss of vision. The main types of surgery for idiopathic IH are shunt surgery and optic nerve sheath fenestration."
5,What are the risk factors for idiopathic intracranial hypertension?,<noinput>,"While the cause of idiopathic intracranial hypertension is unknown, risk factors include being a woman in their 20s and 30s, weight gain, hormone conditions, certain medicines, high levels of vitamin A, iron deficiency anemia, and lupus."
6,Is idiopathic intracranial hypertension a lifelong problem?,<noinput>,"Idiopathic IH is not usually life-threatening, but it can be a lifelong problem. It can affect your vision and there's a risk of losing your vision. Treatment can help with vision problems and reduce the risk of vision loss."
7,What should you do if you notice any changes in your vision?,<noinput>,It's important to tell your doctor straight away if you notice any changes in your vision.
8,Where can I find more information about living with idiopathic intracranial hypertension?,<noinput>,You can find more information about living with idiopathic IH from the IIH UK website.
9,What is the risk of losing vision with idiopathic intracranial hypertension?,<noinput>,"There's a risk of losing vision with idiopathic intracranial hypertension, as the increased pressure around the brain can cause swelling of the optic nerve. Treatment can help reduce this risk."
0,What are the symptoms of intracranial hypertension?,<noinput>,"Symptoms of intracranial hypertension include a constant throbbing headache, temporary loss of vision, feeling and being sick, feeling sleepy, feeling irritable, and more."
1,When should I seek immediate medical attention for symptoms of intracranial hypertension?,<noinput>,"You should call 999 or go to A&E immediately if you have symptoms of intracranial hypertension that have come on quickly, if you've had a head injury, or if you have a high temperature or feel generally unwell."
2,How is intracranial hypertension diagnosed?,<noinput>,"A GP may suspect intracranial hypertension based on symptoms and may refer you to a hospital specialist. Diagnosis may involve tests such as an examination of functions, assessment of eyes and vision, brain scans, and lumbar puncture."
3,What are the treatments for idiopathic intracranial hypertension?,<noinput>,"Treatments for idiopathic intracranial hypertension can include weight loss, stopping medicine causing symptoms, diuretics, medication to reduce cerebrospinal fluid production, steroid medicine, regular lumbar punctures, and surgery if other treatments are ineffective."
4,What are the risk factors for idiopathic intracranial hypertension?,<noinput>,"Idiopathic intracranial hypertension mainly affects women in their 20s and 30s who have gained weight. Other risk factors include hormone conditions, certain medicines, high vitamin A levels, iron deficiency anemia, and lupus."
5,What are the potential complications of idiopathic intracranial hypertension?,<noinput>,Idiopathic intracranial hypertension can affect vision and there is a risk of vision loss due to increased pressure on the brain causing optic nerve swelling. Treatment can help with vision problems and reduce the risk of loss of vision.
6,Can weight loss help with idiopathic intracranial hypertension?,Weight loss,"Yes, weight loss can often help to reduce symptoms and may relieve them altogether in cases of idiopathic intracranial hypertension."
7,What are the surgical options for idiopathic intracranial hypertension?,<noinput>,Surgery may be considered if other treatments are ineffective. Shunt surgery and optic nerve sheath fenestration are the main types of surgery for idiopathic intracranial hypertension.
8,Are there any potentially serious complications associated with surgery for idiopathic intracranial hypertension?,<noinput>,"Yes, surgical procedures for idiopathic intracranial hypertension can provide relief from symptoms but carry a risk of potentially serious complications. It's important to discuss the risks with the surgeon."
9,Where can I find more information about living with idiopathic intracranial hypertension?,<noinput>,You can find more information about living with idiopathic intracranial hypertension from the IIH UK website.
