,q,i,a
0,What is a kidney infection?,<noinput>,A kidney infection is a painful and unpleasant illness caused by bacteria traveling up from the bladder into one or both kidneys.
1,What are the symptoms of a kidney infection?,<noinput>,"Symptoms of a kidney infection include fever, shivering, back or side pain, frequent urination, pain or burning sensation when urinating, smelly or cloudy urine, and blood in the urine."
2,When should I see a GP for a kidney infection?,<noinput>,"You should see a GP if you have fever, persistent pain in the abdomen, lower back, or genitals, symptoms of a urinary tract infection that do not improve after a few days, or blood in your urine. If it is an emergency, go to your nearest urgent care center or A&E."
3,How is a kidney infection diagnosed?,<noinput>,"To diagnose a kidney infection, your doctor will ask about your symptoms and medical history. They may also perform a urine test to check for a urinary tract infection (UTI). If you're a male with a confirmed UTI, you may be referred to a urologist for further investigation."
4,What is the treatment for a kidney infection?,<noinput>,"Most kidney infections require prompt treatment with antibiotics to prevent kidney damage or the spread of infection to the bloodstream. Painkillers may also be prescribed. Some cases may require hospitalization and intravenous antibiotics. Recovery usually takes about 2 weeks, but it may be longer for older individuals or those with underlying conditions."
5,What causes a kidney infection?,<noinput>,"A kidney infection usually occurs when bacteria, such as E. coli, enter the urethra and travel to the bladder, causing cystitis, and then ascend to the kidneys. Factors that increase the risk of kidney infection include sexual activity, improper hygiene, kidney problems (e.g., kidney stones), diabetes, and a weakened immune system."
6,How can I prevent a kidney infection?,<noinput>,"To prevent kidney infections, it is recommended to drink plenty of fluids, urinate as soon as you feel the need, urinate after sexual activity, wipe from front to back after using the toilet, wash your genitals daily, and treat constipation. Avoid using diaphragms or spermicide-coated condoms if you are prone to UTIs."
7,What increases the risk of kidney infection in women?,<noinput>,"Women are more prone to kidney infections due to their shorter urethra, which makes it easier for bacteria to reach the kidneys. Younger women are at higher risk due to increased sexual activity."
8,Can recurring urine infections be prevented?,<noinput>,"For individuals experiencing recurrent urine infections, a GP may prescribe a low dose of antibiotics to be taken regularly. This may help prevent infection recurrence or the spread of infection to the kidneys."
0,What causes a kidney infection?,<noinput>,"A kidney infection is usually caused by bacteria, such as E. coli, that enters the urinary tract and travels up to the kidneys. It can also occur if you have a kidney problem or weakened immune system."
1,What are the symptoms of a kidney infection?,<noinput>,"Symptoms of a kidney infection include fever, back or side pain, frequent urination, pain or burning during urination, cloudy or bloody urine. If you have these symptoms, it's important to see a doctor."
2,When should I see a doctor for a possible kidney infection?,<noinput>,"You should see a doctor if you have a fever and persistent pain in your abdomen, lower back, or genitals. It's also important to seek medical attention if you have symptoms of a urinary tract infection that don't improve after a few days or if you notice blood in your urine."
3,How is a kidney infection diagnosed?,<noinput>,"To diagnose a kidney infection, a doctor will ask about your symptoms and medical history. They may also perform a urine test to check for the presence of bacteria or a urinary tract infection."
4,What is the treatment for a kidney infection?,<noinput>,"Treatment for a kidney infection usually involves antibiotics to fight the infection and painkillers to relieve discomfort. In more severe cases or for individuals at high risk, hospitalization and intravenous antibiotics may be necessary."
5,How long does it take to recover from a kidney infection?,<noinput>,"Most people start to feel better within a few days of starting antibiotic treatment for a kidney infection. However, full recovery can take about 2 weeks. Older adults or those with underlying health conditions may take longer to recover."
6,How can I prevent a kidney infection?,<noinput>,"To prevent a kidney infection, it is important to maintain good hygiene, drink plenty of fluids, and empty your bladder regularly. Going to the bathroom after sex and wiping from front to back can also help reduce the risk of infection."
7,Who is at higher risk for kidney infections?,<noinput>,"Kidney infections can occur at any age, but they are more common in women. Women have a higher risk due to their shorter urethra, which makes it easier for bacteria to reach the kidneys. Younger sexually active women are particularly at risk."
8,Can a kidney infection cause permanent damage?,<noinput>,"If left untreated, a kidney infection can potentially cause permanent kidney damage. It is important to seek prompt medical treatment to prevent complications."
9,Can recurrent urine infections be prevented?,<noinput>,"In some cases, a doctor may prescribe a low dose of antibiotics to be taken regularly to prevent recurrent urine infections. It's also important to maintain good hygiene, stay hydrated, and empty your bladder regularly."
0,What are the symptoms of a kidney infection?,"A kidney infection is characterized by fever, chills, back pain, frequent urination, painful urination, cloudy urine, and blood in urine.",
1,When should I see a GP for a kidney infection?,"If you have persistent fever, severe pain in the abdomen, lower back, or genitals, or if you have symptoms of a urinary tract infection that do not improve after a few days, you should see a GP.",
2,How is a kidney infection diagnosed?,"To diagnose a kidney infection, the doctor will ask about your symptoms and medical history, and may conduct a urine test to check for a urinary tract infection.",
3,How is a kidney infection treated?,Most kidney infections are treated with antibiotics to prevent kidney damage or the spread of infection. Painkillers may also be prescribed.,
4,What are the causes of kidney infection?,"Kidney infections usually occur when bacteria, such as E. coli, enter the urinary tract. They can travel from the bladder to the kidneys. Other causes include kidney problems, kidney stones, diabetes, or a weakened immune system.",
5,Who is at risk of developing a kidney infection?,"Kidney infections can occur at any age, but are more common in women. Women are at a higher risk due to their shorter urethra and sexual activity. People with kidney problems, kidney stones, diabetes, or a weakened immune system are also at risk.",
6,How can kidney infections be prevented?,"To prevent kidney infections, it is important to maintain good hygiene, drink plenty of fluids, urinate after sex, wipe from front to back, treat constipation, and avoid using diaphragms or spermicide-coated condoms if prone to UTIs.",
7,How long does it take to recover from a kidney infection?,"Prompt treatment with antibiotics usually results in complete recovery within 2 weeks. However, older individuals or those with underlying conditions may take longer to recover.",
8,Can a kidney infection cause permanent kidney damage?,"If a kidney infection is left untreated, it can get worse and sometimes lead to permanent kidney damage. This is why prompt treatment with antibiotics is crucial.",
9,Can recurrent urine infections be prevented?,"In cases of recurrent urine infections, a GP may prescribe a low dose of antibiotics to be taken regularly, which may help prevent the infection from returning or spreading to the kidneys.",
