,q,i,a
0,What are the symptoms of lichen sclerosus?,<noinput>,"The symptoms of lichen sclerosus include itchy white patches on the genitals or other parts of the body. The patches are usually itchy, white, smooth or wrinkled, and easily damaged."
1,How can lichen sclerosus be managed?,<noinput>,"To manage lichen sclerosus, you can wash with an emollient soap substitute, dab your genitals dry, apply a barrier cream, wear cotton or silk underwear, and use vaginal lubricant if sex is uncomfortable."
2,When should I see a doctor for lichen sclerosus?,<noinput>,"You should see a doctor if you have an itchy white patch on your genitals or skin, if treatment is not helping, or if you have pain when going to the toilet or having sex."
3,What is the treatment for lichen sclerosus?,<noinput>,"Lichen sclerosus cannot be cured, but prescription steroid cream is usually recommended to relieve the symptoms. The cream needs to be used regularly for a few months to get the symptoms under control."
4,Can lichen sclerosus cause complications?,<noinput>,"Yes, lichen sclerosus can cause complications such as scarring and tightness of the affected skin. This can lead to discomfort during urination, bowel movements, and sex. In severe cases, surgery may be necessary to address these complications."
5,Does lichen sclerosus increase the risk of cancer?,<noinput>,"Yes, lichen sclerosus increases the risk of cancer on the vulva, penis, or anus. It's important to regularly check yourself for any lumps, changes in skin texture, or persistent ulcers, and consult a doctor if you're concerned."
6,What causes lichen sclerosus?,<noinput>,"The exact cause of lichen sclerosus is unknown, but it is believed to be related to the immune system mistakenly attacking and damaging the skin. It is not contagious and is not caused by poor personal hygiene."
7,Are there any age or gender factors associated with lichen sclerosus?,<noinput>,"Lichen sclerosus can affect people of all ages, including children, but it is more common in women over 50. It can occur in individuals with different skin colors."
8,What are the common affected areas of lichen sclerosus?,<noinput>,"The common affected areas of lichen sclerosus include the area around the opening to the vagina (vulva) and anus, as well as the foreskin and end of the penis."
9,Is there a cure for lichen sclerosus?,<noinput>,"There is no cure for lichen sclerosus, but treatment can help relieve the symptoms. Prescription steroid cream is often used to manage the condition."
0,What are the symptoms of lichen sclerosus?,<noinput>,"The symptoms of lichen sclerosus include itchy white patches on the genitals or other parts of the body. The patches are usually itchy, white, smooth or crinkled, and easily damaged."
1,What can I do to help with lichen sclerosus?,<noinput>,"To help with lichen sclerosus, you can wash with an emollient soap substitute, dab your genitals dry after peeing, apply a barrier cream or ointment, wear cotton or silk underwear, and use vaginal lubricant if sex is uncomfortable."
2,When should I see a GP for lichen sclerosus?,<noinput>,"You should see a GP if you have an itchy white patch on your genitals or skin, if you have been diagnosed with lichen sclerosus and treatment is not helping, or if you have been diagnosed with lichen sclerosus and have pain when going to the toilet or having sex."
3,How is lichen sclerosus treated?,<noinput>,"Lichen sclerosus cannot be cured, but prescription steroid cream usually helps relieve the symptoms. You may need to use the cream regularly for a few months or as directed by your doctor."
4,What problems can be caused by lichen sclerosus?,<noinput>,"Lichen sclerosus can cause scarring and tightness of the skin over time, which can lead to discomfort during urination, bowel movements, and sex. In severe cases, a small operation such as surgery may be needed."
5,Does lichen sclerosus increase the risk of cancer?,<noinput>,"Yes, lichen sclerosus increases the risk of getting cancer on the vulva, penis, or anus. It is important to check yourself regularly for any lumps or changes in skin texture and see a GP if you're worried."
6,What are the possible causes of lichen sclerosus?,<noinput>,"The exact cause of lichen sclerosus is unknown, but it may be caused by the immune system mistakenly attacking and damaging the skin. It is not contagious and is not caused by poor personal hygiene."
7,Can lichen sclerosus affect people of all ages?,<noinput>,"Yes, lichen sclerosus can affect people of all ages, including children. However, it is more common in women over the age of 50."
8,What does lichen sclerosus look like?,<noinput>,"Lichen sclerosus appears as itchy white patches on the genitals or other parts of the body. The patches can be white, smooth or crinkled, and easily damaged."
9,Can people with any skin color get lichen sclerosus?,<noinput>,"Yes, people with white, brown, or black skin can get lichen sclerosus."
