,q,i,a
0,What are the symptoms of long QT syndrome?,<noinput>,"Symptoms of long QT syndrome can include blackouts or fainting, seizures, and heart palpitations."
1,What can trigger symptoms of long QT syndrome?,<noinput>,"Symptoms of long QT syndrome can be triggered by stress, sudden noises, strenuous exercise, or a slow heart rate during sleep."
2,What is the risk of death in long QT syndrome?,<noinput>,"If left untreated during an episode, long QT syndrome can lead to cardiac arrest and death."
3,How is long QT syndrome diagnosed?,<noinput>,Diagnosis of long QT syndrome involves an electrocardiogram (ECG) and may require genetic testing.
4,What are the treatment options for long QT syndrome?,<noinput>,"Treatment for long QT syndrome may include medication with beta blockers, pacemaker or implantable cardioverter defibrillator (ICD) placement, and in some cases, surgery."
5,How can I live with long QT syndrome?,<noinput>,"Living with long QT syndrome may require lifestyle adjustments such as avoiding strenuous exercise or startling noises, staying hydrated, and ensuring proper medication management."
6,What are some potassium-rich foods that can be included in the diet for long QT syndrome?,<noinput>,"Potassium-rich foods that can be included in the diet for long QT syndrome are bananas, vegetables, pulses, nuts and seeds, milk, fish, shellfish, beef, chicken, and turkey."
7,What precautions should I take if I have long QT syndrome?,<noinput>,"If you have long QT syndrome, it is important to inform medical staff about your condition, avoid stressful situations, and carefully review any new medications for suitability."
8,Can long QT syndrome be a cause of sudden cardiac death?,<noinput>,"Yes, long QT syndrome is a leading cause of sudden cardiac death in young, otherwise healthy individuals."
9,What are the causes of long QT syndrome?,<noinput>,Long QT syndrome is usually caused by a faulty gene inherited from a parent. Certain medications can also trigger the condition.
0,What is long QT syndrome?,<noinput>,"Long QT syndrome is an inherited heart problem that affects how your heart beats. In some people, this can cause fainting or fits (seizures)."
1,What are the symptoms of long QT syndrome?,<noinput>,"Symptoms of long QT syndrome include blackouts or fainting, seizures, and heart palpitations. These symptoms can start unexpectedly and may be triggered by stress, sudden noise, or strenuous exercise."
2,What is the risk of death associated with long QT syndrome?,<noinput>,"If long QT syndrome is not treated in time with a defibrillator, the heart can stop pumping and the person may die. It is important to call 999 for an ambulance if someone with long QT syndrome suddenly collapses and does not regain consciousness."
3,What are the causes of long QT syndrome?,<noinput>,Long QT syndrome is usually caused by a faulty gene inherited from a parent. Certain medicines can also trigger long QT syndrome.
4,How is long QT syndrome diagnosed?,<noinput>,"Long QT syndrome can be diagnosed through an electrocardiogram (ECG) and genetic testing. An ECG records the heart's rhythm and electrical activity, while genetic testing helps identify the faulty gene causing the syndrome."
5,What are the treatment options for long QT syndrome?,<noinput>,"Most people with long QT syndrome are treated with medicines, such as beta blockers. In severe cases, a pacemaker or implantable cardioverter defibrillator (ICD) may be fitted. Surgery may also be necessary in some cases."
6,How can someone with long QT syndrome manage their condition in their daily life?,<noinput>,"People with long QT syndrome may need to make lifestyle adjustments, such as avoiding strenuous exercise, startling noises, and stressful situations. Proper hydration and a diet rich in potassium may also be recommended."
7,What supplements or foods can help with long QT syndrome?,<noinput>,"Potassium supplements and foods rich in potassium, such as bananas, vegetables, pulses, nuts and seeds, milk, fish, shellfish, beef, chicken, and turkey, can be beneficial for individuals with long QT syndrome."
8,How can someone get more information about living with long QT syndrome?,<noinput>,"The British Heart Foundation offers a booklet about life with inherited abnormal heart rhythms, which provides more information on living with long QT syndrome."
0,What are the symptoms of long QT syndrome?,<noinput>,"The symptoms of long QT syndrome can include blackouts or fainting, seizures, and heart palpitations."
1,What is the risk of death with long QT syndrome?,<noinput>,"If long QT syndrome is not treated with a defibrillator in time, it can lead to cardiac arrest and death."
2,What are the causes of long QT syndrome?,<noinput>,Long QT syndrome is usually caused by a faulty gene inherited from a parent. Certain medicines can also trigger it.
3,How is long QT syndrome diagnosed?,<noinput>,Long QT syndrome can be diagnosed through an electrocardiogram (ECG) and genetic testing.
4,What are the treatment options for long QT syndrome?,<noinput>,"Treatment options for long QT syndrome include beta blockers, pacemakers, implantable cardioverter defibrillators (ICDs), and in some cases, surgery."
5,How can one live with long QT syndrome?,<noinput>,"Living with long QT syndrome may require lifestyle adjustments such as avoiding strenuous exercise and stressful situations, and following a specific diet."
6,Can long QT syndrome have a major impact on daily life?,<noinput>,"With the right treatment, it is possible to manage long QT syndrome and minimize its impact on daily life."
7,What lifestyle adjustments may be needed for people with long QT syndrome?,<noinput>,"People with long QT syndrome may need to avoid strenuous exercise, startling noises, and stressful situations."
8,What foods are rich in potassium?,<noinput>,"Potassium-rich foods include bananas, vegetables, pulses, nuts and seeds, milk, fish, shellfish, beef, chicken, and turkey."
9,Where can I get more information about long QT syndrome?,<noinput>,You can get a booklet about life with inherited abnormal heart rhythms from the British Heart Foundation.
