,q,i,a
0,What are the main symptoms of multiple sclerosis?,<noinput>,"The main symptoms of multiple sclerosis include fatigue, difficulty walking, vision problems, bladder control issues, numbness or tingling, muscle stiffness, balance problems, and cognitive difficulties."
1,How can I get medical advice if I suspect I have signs of MS?,<noinput>,"If you're worried about signs of MS, it's best to see a GP. They can assess your symptoms and refer you to a neurologist for further evaluation and tests, such as an MRI scan."
2,What are the types of multiple sclerosis?,<noinput>,"There are two main types of multiple sclerosis: relapsing remitting MS, characterized by episodes of new or worsening symptoms, and primary progressive MS, where symptoms gradually worsen over time without distinct relapses."
3,What causes multiple sclerosis?,<noinput>,Multiple sclerosis is an autoimmune condition where the immune system mistakenly attacks the myelin sheath that protects the nerves in the brain and spinal cord. The exact cause is unknown but is believed to involve a combination of genetic and environmental factors.
4,What treatments are available for multiple sclerosis?,<noinput>,"While there is no cure for MS, there are treatments available to help control the condition and manage symptoms. These may include steroid medications to treat relapses, disease-modifying therapies to reduce relapse frequency, and specific treatments for individual MS symptoms."
5,How can I live well with multiple sclerosis?,<noinput>,"If you have been diagnosed with MS, taking care of your general health is important. It's also beneficial to seek support from MS charities, such as the MS Society or MS Trust, as they offer advice, resources, and online communities for individuals affected by MS."
6,What is the average life expectancy for people with multiple sclerosis?,<noinput>,"The average life expectancy for people with MS is around 5 to 10 years lower than average. However, advancements in treatments have improved the quality of life for individuals with MS, and the gap in life expectancy is narrowing."
7,Are there any charities or support groups for multiple sclerosis?,<noinput>,"Yes, in the UK, there are MS charities such as the MS Society and MS Trust that offer support, advice, and resources for individuals with MS. There is also an online community called shift.ms specifically for younger people affected by MS."
8,Where can I find more information about social care and support for MS?,<noinput>,"If you need help with day-to-day living or care for someone with MS, you can refer to the social care and support guide, which explains available options and sources of support."
0,What are the main symptoms of multiple sclerosis?,<noinput>,"The main symptoms of MS include fatigue, difficulty walking, vision problems, bladder problems, numbness or tingling, muscle stiffness, balance and coordination problems, and problems with thinking, learning, and planning."
1,When should I see a doctor if I suspect I have signs of MS?,<noinput>,"If you're worried about having signs of MS, it's best to see a GP. They can assess your symptoms and refer you to a specialist in conditions of the nervous system for further evaluation."
2,What are the different types of multiple sclerosis?,<noinput>,"There are two main types of MS: relapsing remitting MS and primary progressive MS. Relapsing remitting MS involves episodes of new or worsening symptoms, while primary progressive MS is characterized by a gradual worsening of symptoms over time."
3,What causes multiple sclerosis?,<noinput>,"MS is an autoimmune condition where the immune system mistakenly attacks the myelin sheath, the protective layer around the nerves. The exact cause is unclear, but both genetic and environmental factors play a role."
4,What treatments are available for multiple sclerosis?,<noinput>,"While there is currently no cure for MS, there are several treatments available to manage the condition and alleviate symptoms. These include short courses of steroid medicine to treat relapses, specific treatments for individual symptoms, and disease-modifying therapies to reduce the number of relapses and slow the progression of disability."
5,How can I live well with multiple sclerosis?,<noinput>,"If you have been diagnosed with MS, it's important to take care of your general health. This may involve following a balanced diet, exercising regularly, managing stress, getting enough sleep, and seeking support from healthcare professionals and support groups."
6,What is the outlook for people with multiple sclerosis?,<noinput>,"While MS can be challenging to live with, advancements in treatments have significantly improved the quality of life for individuals with the condition. MS itself is rarely fatal, but complications can arise. The average life expectancy for people with MS is slightly lower than average, but this gap is decreasing over time."
7,Are there any charities or support groups for multiple sclerosis?,<noinput>,"Yes, there are two main MS charities in the UK: the MS Society and the MS Trust. They offer advice, publications, ongoing research updates, and online communities. There is also the shift.ms website, which provides support for younger people affected by MS."
8,Where can I find more information about social care and support for MS?,<noinput>,The social care and support guide can provide information on options and support available for individuals who need assistance with day-to-day living due to illness or disability or who regularly care for someone in those situations.
0,What are the main symptoms of multiple sclerosis?,<noinput>,"The main symptoms of multiple sclerosis include fatigue, difficulty walking, vision problems, problems controlling the bladder, numbness or tingling in different parts of the body, muscle stiffness and spasms, problems with balance and coordination, and problems with thinking, learning and planning."
1,How can I get medical advice if I'm worried about having multiple sclerosis?,<noinput>,"If you're worried about having multiple sclerosis, you should see a GP. Let the GP know about the specific pattern of symptoms you're experiencing. They may refer you to a neurologist for further tests."
2,What are the types of multiple sclerosis?,<noinput>,There are two main types of multiple sclerosis: relapsing remitting MS and primary progressive MS.
3,What is relapsing remitting MS?,<noinput>,"Relapsing remitting MS is the most common type. It is characterized by episodes of new or worsening symptoms, known as relapses, followed by periods of remission."
4,What is primary progressive MS?,<noinput>,Primary progressive MS is a type of MS where symptoms gradually worsen and accumulate over several years without periods of remission.
5,What causes multiple sclerosis?,<noinput>,"Multiple sclerosis is an autoimmune condition where the immune system mistakenly attacks the myelin sheath, the protective layer surrounding the nerves. The exact cause is unclear, but a combination of genetic and environmental factors is believed to be involved."
6,What are the treatments for multiple sclerosis?,<noinput>,"There is currently no cure for MS, but there are treatments available to help control the condition and ease symptoms. These may include short courses of steroid medicine for relapses, specific treatments for individual symptoms, and disease-modifying therapies to reduce the number of relapses."
7,How can I live with multiple sclerosis?,<noinput>,"If you have been diagnosed with MS, it's important to take care of your general health. There are resources available to provide advice and support for living with the condition."
8,What is the outlook for people with multiple sclerosis?,<noinput>,"MS can be a challenging condition to live with, but new treatments have improved the quality of life for people with the condition. While MS itself is rarely fatal, complications may arise from severe MS. The average life expectancy for people with MS is around 5 to 10 years lower than average."
9,Are there any charities or support groups for multiple sclerosis?,<noinput>,"Yes, there are several charities and support groups for multiple sclerosis in the UK, including MS Society, MS Trust, and the shift.ms online community for younger people affected by MS."
