,q,i,a
0,What are the functions of the spleen?,<noinput>,"The spleen has several important functions, including fighting invading germs in the blood, controlling the level of blood cells, and filtering the blood to remove old or damaged red blood cells."
1,What are the signs of a damaged or ruptured spleen?,<noinput>,"Signs of a damaged or ruptured spleen include pain behind the left ribs and tenderness, dizziness and rapid heart rate (a sign of low blood pressure), and it is considered a medical emergency due to the risk of life-threatening bleeding."
2,What causes an enlarged spleen?,<noinput>,"An enlarged spleen can be caused by infections, injuries, or certain health conditions such as cirrhosis, leukemia, or rheumatoid arthritis."
3,How is the spleen removed?,<noinput>,"The spleen can be removed through laparoscopic (keyhole) surgery or open surgery, depending on the circumstances. Laparoscopic surgery involves making small cuts in the abdomen, while open surgery requires making a larger cut."
4,What is the recovery process like after spleen surgery?,<noinput>,"After spleen surgery, it is normal to feel sore and be bruised, but pain relief will be provided. You should be able to eat and drink as normal soon after the operation. Recovery usually takes a few weeks, and your doctor or nurse will advise when you can resume your usual activities."
5,Can you live without a spleen?,<noinput>,"Yes, if your spleen needs to be removed, other organs like the liver can take over its functions. However, there is a small risk of developing a serious infection, which can be minimized by following precautions such as getting vaccinations and taking antibiotics as recommended."
6,What vaccinations are recommended after spleen removal?,<noinput>,"It is recommended to have routine vaccinations, as well as vaccinations for pneumococcal infections and flu. The specific vaccinations should be confirmed with your GP."
7,What should I do if I get an infection without a spleen?,<noinput>,"If you get signs of an infection, such as a high temperature, sore throat, or abdominal pain, see a GP as soon as possible. They can prescribe antibiotics to treat the infection."
8,How should I protect myself from animal and tick bites without a spleen?,<noinput>,"Bites from animals and ticks can cause infections. If bitten by an animal, start your course of antibiotics if you have them and seek medical advice urgently. When trekking or camping, wear clothes that cover your skin and try to avoid tick bites. If you become ill, seek medical advice promptly."
9,What travel advice should I follow without a spleen?,<noinput>,"If you're traveling abroad, you may be advised to take a course of antibiotics with you. Check if you need any travel vaccinations and consider the risk of severe malaria. Use mosquito nets and insect repellent to minimize the risk."
0,What are the functions of the spleen?,<noinput>,"The spleen fights invading germs, controls the level of blood cells, and filters the blood by removing old or damaged red blood cells."
1,What are the symptoms of a damaged or ruptured spleen?,<noinput>,"Signs of a damaged or ruptured spleen include pain behind the left ribs, tenderness upon touching the area, dizziness, and a rapid heart rate. It is a medical emergency and requires immediate medical attention."
2,When is spleen removal surgery necessary?,<noinput>,"Spleen removal surgery, known as splenectomy, may be necessary if the spleen is not working properly, damaged, diseased, or enlarged."
3,What is laparoscopy and how is it used in spleen removal surgery?,<noinput>,Laparoscopy is a minimally invasive technique used in spleen removal surgery. It involves making small cuts in the abdomen and using a laparoscope and thin instruments to remove the spleen. It results in less scarring and a quicker recovery time.
4,What are the risks and complications associated with spleen removal surgery?,<noinput>,"Complications of spleen removal surgery include bleeding, infection, and the surgical wound becoming infected. It's important to follow post-operative care instructions and seek medical attention if any signs of infection are present."
5,What precautions should be taken after spleen removal?,<noinput>,"After spleen removal, precautions should be taken to prevent infection. This includes receiving vaccinations against pneumococcal infections and the flu, taking low-dose antibiotics, and seeking medical attention at the first signs of infection."
6,What should be done in case of animal or tick bites after spleen removal?,<noinput>,"Bites from animals and ticks can cause infections, so it's important to start antibiotics if bitten by an animal and seek medical advice urgently. Taking precautionary measures to avoid tick bites, such as wearing protective clothing, is also recommended."
7,What should individuals without a spleen do when seeking medical treatment?,<noinput>,"Individuals without a spleen should inform medical professionals about their spleen problems. Healthcare professionals should mark their health records, and it's a good idea to carry or wear medical identification, such as a splenectomy card or medical ID."
8,What travel advice should be followed for individuals without a spleen?,<noinput>,"When traveling abroad, individuals without a spleen may be advised to take antibiotics with them. They should also check if any travel vaccinations are necessary and take precautions to prevent malaria if visiting a malaria-endemic country."
9,What is the increased risk associated with individuals without a spleen?,<noinput>,"Individuals without a spleen have an increased risk of developing severe forms of infections and malaria. It's important to follow preventive measures, take antibiotics as prescribed, and seek medical attention promptly."
