,q,i,a
0,What are the main symptoms of Tourette's syndrome?,<noinput>,"The main symptoms of Tourette's syndrome are a combination of physical and vocal tics. Physical tics can include blinking, eye rolling, grimacing, shoulder shrugging, and jerking of the head or limbs. Vocal tics can include grunting, throat clearing, whistling, coughing, and saying random words and phrases."
1,How do premonitory sensations relate to Tourette's syndrome?,<noinput>,Premonitory sensations are strong urges felt before a tic in Tourette's syndrome. They are relieved only after the tic occurs. Examples of premonitory sensations include a burning feeling in the eyes before blinking and an itchy joint or muscle before jerking.
2,How can people with Tourette's syndrome control their tics?,<noinput>,"Some people with Tourette's syndrome can control their tics for a short while in certain social situations, like in a classroom, with concentration. However, controlling tics can be tiring, and a sudden release of tics may occur after a day of trying to control them."
3,When should I seek medical advice for tics?,<noinput>,"If you or your child start having tics, it is recommended to contact a GP. While tics can occur in many children and may not indicate Tourette's syndrome, it's best to consult a medical professional for evaluation."
4,How is Tourette's syndrome diagnosed?,<noinput>,"There is no single test for Tourette's syndrome. To be diagnosed, you need to have had several tics for at least a year. A diagnosis can be obtained by consulting a GP who may refer you to a neurologist for further evaluation."
5,What treatments are available for Tourette's syndrome?,<noinput>,"While there is no cure for Tourette's syndrome, treatment options include behavioral therapy and medication. Behavioral therapy involves techniques like habit reversal training and exposure with response prevention. Medication may be recommended for more severe tics."
6,What are the causes of Tourette's syndrome?,<noinput>,"The exact cause of Tourette's syndrome is unknown, but it is believed to be linked to a part of the brain that regulates body movements. It is more commonly seen in boys than girls."
7,Where can I find further help and support for Tourette's syndrome?,<noinput>,"For more information about treatment and support for Tourette's syndrome, you can contact the charity Tourettes Action."
8,What are the types of behavioral therapy used to treat Tourette's syndrome?,<noinput>,"The two types of behavioral therapy commonly used to treat Tourette's syndrome are habit reversal training and exposure with response prevention (ERP). Habit reversal training involves finding alternative ways to relieve the urge to tic, while ERP helps in better control of the urge to tic."
9,Are there any side effects of medication for Tourette's syndrome?,<noinput>,"Medications for Tourette's syndrome can have side effects, and they are not effective for everyone. It is usually recommended for more severe tics or when tics significantly affect daily activities."
0,What are the symptoms of Tourette's syndrome?,<noinput>,"The main symptoms of Tourette's syndrome are physical and vocal tics. Physical tics include blinking, grimacing, shoulder shrugging, and touching objects. Vocal tics include throat clearing, coughing, and saying random words."
1,Can Tourette's syndrome be cured?,<noinput>,"There is no cure for Tourette's syndrome, but treatment can help manage the symptoms."
2,What are premonitory sensations in Tourette's syndrome?,<noinput>,Premonitory sensations are strong urges that people with Tourette's syndrome experience before a tic. These urges are relieved only after the tic is carried out.
3,How can tics be controlled in Tourette's syndrome?,<noinput>,"Some people can control their tics for a short while in certain social situations, but it requires concentration. Tics may also be less noticeable during activities involving a high level of concentration."
4,When should I seek medical advice for tics?,<noinput>,"You should contact a GP if you or your child start having tics, as it may not necessarily mean having Tourette's syndrome."
5,How is Tourette's syndrome diagnosed?,<noinput>,"There is no single test for Tourette's syndrome. Diagnosis is made based on having several tics for at least a year, ruling out other conditions through tests and scans."
6,What are the treatment options for Tourette's syndrome?,<noinput>,"Treatment may involve behavioral therapy, such as habit reversal training or exposure with response prevention. Medicines may also be recommended for more severe tics."
7,What are the causes of Tourette's syndrome?,<noinput>,"The cause of Tourette's syndrome is unknown, but it's thought to be linked to a part of the brain that helps regulate body movements."
8,Are there any support organizations for Tourette's syndrome?,<noinput>,"For more information about treatment and support, you can contact the charity Tourettes Action."
9,Where can I find a video about Tourette's syndrome and its treatment?,<noinput>,You can watch a video about Tourette's syndrome and its treatment by contacting the charity Tourettes Action.
